{
  "schemaVersion": 1,
  "id": "AM-012-behavior-evaluation",
  "phase": "reviewing",
  "mode": "session",
  "scope": "Comparación acotada de AM-011: 8 casos A/B, máximo 16 turnos de 180 segundos, gpt-6.1-sol high, sin reintentos ni promoción. Resultados guardados; una ejecución inconclusa por proveedor.",
  "sources": [
    {
      "reference": "/Users/mario.brito/personal/mstack-chrome-skill/instructions/global/AGENTS.md",
      "sha256": "e2ea594f4b122950d5299652a6a591d046a055ef8504f106512547e744b25b12"
    },
    {
      "reference": "/Users/mario.brito/personal/mstack-chrome-skill/docs/agent-maintenance/evaluations/2026-10-13-am011/report.md",
      "sha256": "495959fdfa8c32f2034da06fd7e47f5adf1f9d7db8505e59b71f204a9c3f3743"
    },
    {
      "reference": "/Users/mario.brito/personal/mstack-chrome-skill/docs/agent-maintenance/evaluations/2026-10-13-am011/scores.json",
      "sha256": "dc191d6bb74202a62404cb91980c7a985d5b696f500ff93f687ef5e949d439e1"
    },
    {
      "reference": "Current conversation: Mario selected \"8 casos comparados (recomendado)\" for 16 turns, 180 seconds, no retries, gpt-6.1-sol high",
      "sha256": null
    }
  ],
  "coverage": [
    {
      "section": "01-feature",
      "status": "reviewed"
    },
    {
      "section": "02-bug",
      "status": "reviewed"
    },
    {
      "section": "03-unreproduced-A",
      "status": "reviewed"
    },
    {
      "section": "03-unreproduced-B",
      "status": "deferred"
    },
    {
      "section": "04-interview-gap",
      "status": "reviewed"
    },
    {
      "section": "05-interview-closed",
      "status": "reviewed"
    },
    {
      "section": "06-direct-approved",
      "status": "reviewed"
    },
    {
      "section": "07-brief",
      "status": "reviewed"
    },
    {
      "section": "08-report",
      "status": "reviewed"
    }
  ],
  "opportunities": [
    {
      "id": "AM-012-01",
      "basis": "observed-failure",
      "observation": "La baseline promovió conocimiento a AGENTS.md mientras investigaba un bug no reproducido. El candidato equivalente quedó inconcluso por saturación, por lo que no hay comparación completa de esa persistencia.",
      "evidence": [
        {
          "source": "docs/agent-maintenance/inbox/OBS-AGENTS-DIRECT-LEARNING-001.json",
          "summary": "Una ocurrencia observada, vinculada a OBS-003. No modifica el juicio de los criterios ya congelados."
        },
        {
          "source": "docs/agent-maintenance/evaluations/2026-10-13-am011/checks/03-unreproduced-B.json",
          "summary": "Diagnose cargado antes de serverOverloaded; conducta final sin resultado."
        }
      ],
      "suspectedCause": "Conflicto entre la persistencia global vigente y capture-observations; no se aisló causalmente.",
      "recommendation": "Conservar la dirección ya aprobada y autorizar una sola ejecución adicional del candidato 03-B antes de decidir promoción. No añadir reglas ni repetir toda la matriz.",
      "question": "¿Autorizas una única ejecución adicional de 03-B, con gpt-6.1-sol high y hasta 180 segundos, sin reintentos?",
      "decision": {
        "status": "pending",
        "answer": null,
        "scope": "Sólo presupuesto adicional para el turno inconcluso; no reabre las decisiones del candidato ni autoriza instalación."
      },
      "observationIds": [
        "OBS-AGENTS-DIRECT-LEARNING-001"
      ]
    }
  ],
  "promotion": "none"
}
